{"_D":"urn:oasis:names:specification:ubl:schema:xsd:GoodsItemItinerary-2",
 "_A":"urn:oasis:names:specification:ubl:schema:xsd:CommonAggregateComponents-2",
 "_B":"urn:oasis:names:specification:ubl:schema:xsd:CommonBasicComponents-2",
 "GoodsItemItinerary":{
 "UBLVersionID":{"_":"2.1"},
 "ID":{"_":"1"},
 "IssueDate":{"_":"2011-09-13"},
 "IssueTime":{"_":"10:05:20+01:00"},
 "VersionID":{"_":"1"},
 "TransportExecutionPlanReferenceID":{"_":"TEP_1"},
 "SenderParty":{
  "PartyIdentification":[{
   "ID":{"_":"4058673827641",
    "schemeAgencyName":"GS1",
    "schemeName":"GLN"}
  }],
  "PartyName":[{
   "Name":{"_":"NECOSS"}
  }],
  "Contact":{
   "Name":{"_":"SomeName"},
   "Telephone":{"_":"+49450557000"},
   "ElectronicMail":{"_":"SomeName@necoss.de"}
  }
 },
 "ReceiverParty":{
  "PartyIdentification":[{
   "ID":{"_":"4058673827000",
    "schemeAgencyName":"GS1",
    "schemeName":"GLN"}
  }],
  "PartyName":[{
   "Name":{"_":"Consignor"}
  }],
  "Contact":{
   "Name":{"_":"SomeName"},
   "Telephone":{"_":"+8687878763"},
   "ElectronicMail":{"_":"SomeName@consignor.cn"}
  }
 },
 "ReferencedTransportEquipment":[{
  "ID":{"_":"1"},
  "TransportEquipmentSeal":[{
   "ID":{"_":"1_1"},
   "Condition":{"_":"IN_RIGHT_CONDITION"}
  }],
  "Package":[{
   "Quantity":{"_":10},
   "PackagingTypeCode":{"_":"PX"},
   "GoodsItem":[{
    "Item":[{
     "CommodityClassification":[{
      "CargoTypeCode":{"_":"12"}
     }]
    }]
   }]
  }]
 },{
  "ID":{"_":"2"},
  "TransportEquipmentSeal":[{
   "ID":{"_":"2_1"},
   "Condition":{"_":"IN_RIGHT_CONDITION"}
  }],
  "Package":[{
   "Quantity":{"_":10},
   "PackagingTypeCode":{"_":"PX"},
   "GoodsItem":[{
    "Item":[{
     "CommodityClassification":[{
      "CargoTypeCode":{"_":"12"}
     }]
    }]
   }]
  }]
 }],
 "TransportationSegment":[{
  "SequenceNumeric":{"_":1},
  "TransportExecutionPlanReferenceID":{"_":"TEP_2"},
  "TransportationService":{
   "TransportServiceCode":{"_":"3"},
   "TransportationServiceDescription":[{"_":"Rail transport service from Hamburg to Bremen"}]
  },
  "TransportServiceProviderParty":{
   "PartyIdentification":[{
    "ID":{"_":"4058673827100",
     "schemeAgencyName":"GS1",
     "schemeName":"GLN"}
   }],
   "PartyName":[{
    "Name":{"_":"NTT"}
   }],
   "Contact":{
    "Name":{"_":"SomeName"},
    "Telephone":{"_":"+49450557777"},
    "ElectronicMail":{"_":"SomeName@ntt.de"}
   }
  },
  "ReferencedConsignment":{
   "ID":{"_":"NTT_1"},
   "TransportHandlingUnit":[{
    "ID":{"_":"NTT_THU_1"},
    "TransportEquipment":[{
     "ID":{"_":"NTT_THU_1"},
     "ContainedInTransportEquipment":[{
      "ID":{"_":"NTT_TE_1"},
      "TransportEquipmentTypeCode":{"_":"RR"},
      "TraceID":{"_":"12345678914564"}
     }],
     "Package":[{
      "ID":{"_":"CON_1"},
      "Quantity":{"_":10}
     }]
    }]
   },{
    "ID":{"_":"NTT_THU_2"},
    "TransportEquipment":[{
     "ID":{"_":"CON_2"},
     "ContainedInTransportEquipment":[{
      "ID":{"_":"NTT_TE_2"},
      "TransportEquipmentTypeCode":{"_":"RR"},
      "TraceID":{"_":"12345678914565"}
     }],
     "Package":[{
      "ID":{"_":"CON_2"},
      "Quantity":{"_":10}
     }]
    }]
   }]
  },
  "ShipmentStage":[{
   "ID":{"_":"1"},
   "TransportModeCode":{"_":"2"},
   "TransportMeansTypeCode":{"_":"230"},
   "PlannedDepartureTransportEvent":{
    "Location":{
     "Address":{
      "ID":{"_":"DEHAM",
       "schemeAgencyName":"UN",
       "schemeName":"UN/LOCODE"},
      "StreetName":{"_":"Neuer Wandrahm 4"},
      "CityName":{"_":"Hamburg"},
      "Country":{
       "IdentificationCode":{"_":"DE"}
      }
     }
    },
    "Period":[{
     "StartDate":{"_":"2011-10-03"},
     "StartTime":{"_":"09:30:10+01:00"},
     "EndDate":{"_":"2011-10-03"},
     "EndTime":{"_":"12:30:10+01:00"}
    }]
   },
   "PlannedArrivalTransportEvent":{
    "Location":{
     "LocationTypeCode":{"_":"13"},
     "Address":{
      "ID":{"_":"4568763527610",
       "schemeAgencyName":"GS1",
       "schemeName":"GLN"},
      "StreetName":{"_":"Ludwig-Erhard-Str. 15"},
      "CityName":{"_":"Bremen"},
      "Country":{
       "IdentificationCode":{"_":"DE"}
      }
     }
    },
    "Period":[{
     "StartDate":{"_":"2011-10-03"},
     "StartTime":{"_":"18:30:10+01:00"},
     "EndDate":{"_":"2011-10-03"},
     "EndTime":{"_":"21:30:10+01:00"}
    }]
   }
  }]
 },{
  "SequenceNumeric":{"_":2},
  "TransportExecutionPlanReferenceID":{"_":"TEP_1"},
  "TransportationService":{
   "TransportServiceCode":{"_":"3"},
   "TransportationServiceDescription":[{"_":"Rail transport service from Bremen to Nurnberg"}]
  },
  "TransportServiceProviderParty":{
   "PartyIdentification":[{
    "ID":{"_":"4058673827641",
     "schemeAgencyName":"GS1",
     "schemeName":"GLN"}
   }],
   "PartyName":[{
    "Name":{"_":"NECOSS"}
   }],
   "Contact":{
    "Name":{"_":"SomeName"},
    "Telephone":{"_":"+49450557000"},
    "ElectronicMail":{"_":"SomeName@necoss.de"}
   }
  },
  "ReferencedConsignment":{
   "ID":{"_":"CON_1"},
   "TransportHandlingUnit":[{
    "ID":{"_":"CON_THU_1"},
    "TransportEquipment":[{
     "ID":{"_":"CON_1"},
     "ContainedInTransportEquipment":[{
      "ID":{"_":"NEC_TE_1"},
      "TransportEquipmentTypeCode":{"_":"RR"},
      "TraceID":{"_":"12345678914542"}
     }],
     "Package":[{
      "ID":{"_":"CON_1"},
      "Quantity":{"_":10}
     }]
    }]
   },{
    "ID":{"_":"CON_THU_2"},
    "TransportEquipment":[{
     "ID":{"_":"CON_2"},
     "ContainedInTransportEquipment":[{
      "ID":{"_":"NEC_TE_2"},
      "TransportEquipmentTypeCode":{"_":"RR"},
      "TraceID":{"_":"12345678914543"}
     }],
     "Package":[{
      "ID":{"_":"CON_2"},
      "Quantity":{"_":10}
     }]
    }]
   }]
  },
  "ShipmentStage":[{
   "ID":{"_":"2"},
   "PlannedDepartureTransportEvent":{
    "Location":{
     "LocationTypeCode":{"_":"13"},
     "Address":{
      "ID":{"_":"4568763527610",
       "schemeAgencyName":"GS1",
       "schemeName":"GLN"},
      "StreetName":{"_":"Ludwig-Erhard-Str. 15"},
      "CityName":{"_":"Bremen"},
      "Country":{
       "IdentificationCode":{"_":"DE"}
      }
     }
    },
    "Period":[{
     "StartDate":{"_":"2011-10-04"},
     "StartTime":{"_":"09:30:10+01:00"},
     "EndDate":{"_":"2011-10-04"},
     "EndTime":{"_":"09:30:10+01:00"}
    }]
   },
   "PlannedArrivalTransportEvent":{
    "Location":{
     "LocationTypeCode":{"_":"13"},
     "Address":{
      "StreetName":{"_":"Sandstr. 38-40"},
      "CityName":{"_":"Nurnberg"},
      "Country":{
       "IdentificationCode":{"_":"DE"}
      }
     }
    },
    "Period":[{
     "StartDate":{"_":"2011-10-04"},
     "StartTime":{"_":"15:30:10+01:00"},
     "EndDate":{"_":"2011-10-04"},
     "EndTime":{"_":"18:30:10+01:00"}
    }]
   }
  }]
 },{
  "SequenceNumeric":{"_":3},
  "TransportExecutionPlanReferenceID":{"_":"TEP_3"},
  "TransportationService":{
   "TransportServiceCode":{"_":"3"},
   "TransportationServiceDescription":[{"_":"Road transport service from Hamburg to Bremen"}]
  },
  "TransportServiceProviderParty":{
   "PartyIdentification":[{
    "ID":{"_":"4058673827112",
     "schemeAgencyName":"GS1",
     "schemeName":"GLN"}
   }],
   "PartyName":[{
    "Name":{"_":"EXT-HAL"}
   }],
   "Contact":{
    "Name":{"_":"SomeName"},
    "Telephone":{"_":"+49450557234"},
    "ElectronicMail":{"_":"SomeName@ext-hal.de"}
   }
  },
  "ReferencedConsignment":{
   "ID":{"_":"EXT_1"},
   "TransportHandlingUnit":[{
    "ID":{"_":"EXT_THU_1"},
    "TransportEquipment":[{
     "ID":{"_":"CON_1"},
     "ContainedInTransportEquipment":[{
      "ID":{"_":"EXT_TE_1"},
      "TransportEquipmentTypeCode":{"_":"TE"},
      "TraceID":{"_":"12345678914111"}
     }],
     "Package":[{
      "ID":{"_":"CON_1"},
      "Quantity":{"_":10}
     }]
    }],
    "TransportMeans":[{
     "RoadTransport":{
      "LicensePlateID":{"_":"WFN667"}
     }
    }]
   },{
    "ID":{"_":"EXT_THU_2"},
    "TransportEquipment":[{
     "ID":{"_":"CON_2"},
     "ContainedInTransportEquipment":[{
      "ID":{"_":"EXT_TE_2"},
      "TransportEquipmentTypeCode":{"_":"TE"},
      "TraceID":{"_":"12345678914112"}
     }],
     "Package":[{
      "ID":{"_":"CON_2"},
      "Quantity":{"_":10}
     }]
    }],
    "TransportMeans":[{
     "RoadTransport":{
      "LicensePlateID":{"_":"WFN667"}
     }
    }]
   }]
  },
  "ShipmentStage":[{
   "ID":{"_":"3"},
   "PlannedDepartureTransportEvent":{
    "Location":{
     "LocationTypeCode":{"_":"13"},
     "Address":{
      "StreetName":{"_":"Sandstr. 38-40"},
      "CityName":{"_":"Nurnberg"},
      "Country":{
       "IdentificationCode":{"_":"DE"}
      }
     }
    },
    "Period":[{
     "StartDate":{"_":"2011-10-06"},
     "StartTime":{"_":"09:30:10+01:00"},
     "EndDate":{"_":"2011-10-06"},
     "EndTime":{"_":"12:30:10+01:00"}
    }]
   },
   "PlannedArrivalTransportEvent":{
    "Location":{
     "Address":{
      "StreetName":{"_":"Grosse strasse 34"},
      "CityName":{"_":"Nurnberg"},
      "Country":{
       "IdentificationCode":{"_":"DE"}
      }
     }
    },
    "Period":[{
     "StartDate":{"_":"2011-10-06"},
     "StartTime":{"_":"12:30:10+01:00"},
     "EndDate":{"_":"2011-10-06"},
     "EndTime":{"_":"15:30:10+01:00"}
    }]
   }
  }]
 }]
}}